{
  "input": {
    "suburb": "Rivervale WA 6103",
    "address": "705/60 Riversdale Road, Rivervale WA 6103",
    "propertyType": "unit",
    "lastYearValuation": 1000000,
    "comparableType": "sold",
    "currency": "AUD"
  },
  "result": {
    "growthPercent": 15.78,
    "currentValuation": 1157800,
    "growthCalculationMethod": "average_of_available_site_growths",
    "sitesUsed": ["realestate.com.au"]
  },
  "siteEstimates": {
    "realestate_com_au": {
      "label": "realestate.com.au",
      "suburbGrowthPercent": 15.78,
      "medianPrice": 910000,
      "medianPricePeriod": "March 2025 - February 2026",
      "propertyEstimateRange": { "low": null, "mid": null, "high": null },
      "estimateAccuracy": null,
      "estimateUpdatedAt": null,
      "propertyTypeMatched": true,
      "comparables": [],
      "soldHistory": [],
      "sourceUrl": "https://www.realestate.com.au/property/unit-705-60-riversdale-rd-rivervale-wa-6103/",
      "notes": ["Growth extracted from rendered DOM", "Median price extracted from rendered DOM"]
    },
    "domain_com_au": {
      "label": "domain.com.au",
      "suburbGrowthPercent": null,
      "medianPrice": null,
      "medianPricePeriod": null,
      "propertyEstimateRange": { "low": 1210000, "mid": 1400000, "high": 1590000 },
      "estimateAccuracy": "High accuracy",
      "estimateUpdatedAt": "2026-03-17",
      "propertyTypeMatched": true,
      "comparables": [],
      "soldHistory": [],
      "sourceUrl": "https://www.domain.com.au/property-profile/705-60-riversdale-road-rivervale-wa-6103",
      "notes": ["Estimate range extracted from estimate card"]
    },
    "property_com_au": {
      "label": "property.com.au",
      "suburbGrowthPercent": null,
      "medianPrice": null,
      "medianPricePeriod": null,
      "propertyEstimateRange": { "low": null, "mid": null, "high": null },
      "estimateAccuracy": null,
      "estimateUpdatedAt": null,
      "propertyTypeMatched": true,
      "comparables": [],
      "soldHistory": [],
      "sourceUrl": "https://www.property.com.au/wa/rivervale-6103/riversdale-rd/705-60-pid-20009700/",
      "notes": ["Backlink discovered from realestate.com.au page"]
    }
  },
  "selectedComparables": [],
  "confidence": "low",
  "assumptions": ["Only validated suburb growth sources contribute to growthPercent"],
  "errors": []
}
